{
 "schema_version": 1,
 "snapshot_id": "2026-10-17_blis-v0.10.0_ix-2026-09-28",
 "generated_at": "2026-10-17T00:00:00Z",
 "provenance": {
  "blis": {
   "release": "v0.10.0",
   "commit_sha": "0d092d4ef64f605046de1181adf8e2b6ee564725",
   "catalog": "0.2.1",
   "registry": "v0.1.1",
   "extractor_version": "blis-latency-kernel@v0.1.0"
  },
  "ground_truth": {
   "source": "SemiAnalysis InferenceX",
   "source_url": "https://github.com/SemiAnalysisAI/InferenceX-app/releases/tag/db-dump/2026-09-28",
   "release_tag": "db-dump/2026-09-28",
   "measurement_date_through": null,
   "measurement_sha256": "391a8eb04272f582a619d56b3e7d54f37bbc518b1588271ac79c48b9167a5218"
  },
  "evaluator_commit": "71752887a2335e13bad85e2fe545324b34362afe",
  "scorer": "signedprobe"
 },
 "coverage": {
  "scored": 24,
  "not_scored": 0,
  "multinode_hidden": 0,
  "failed": 0,
  "measured_excluded": 0,
  "not_scored_reasons": {}
 },
 "known_artefacts": [
  "gpt-oss-120b/h200 TTFT spikes (4)",
  "non-monotone-TPOT sweeps"
 ],
 "metrics": [
  "ttft",
  "tpot"
 ],
 "metricscore_comparison": {
  "raw": "no points scored\n",
  "gated": false
 },
 "totals": {
  "measured_or_resolved": {
   "mape": {
    "ttft": null,
    "tpot": null,
    "n": 0
   },
   "shape": {
    "ttft": null,
    "tpot": null,
    "n": 0
   },
   "noise_floor_pct": 1.6
  },
  "all": {
   "mape": {
    "ttft": 67.76207114432658,
    "tpot": 43.35016933499049,
    "n": 24
   },
   "shape": {
    "ttft": 36.893238288187405,
    "tpot": 21.23725158196423,
    "n": 18
   },
   "noise_floor_pct": 1.6
  }
 },
 "matrix": [
  {
   "level": "model",
   "model": "deepseek-v4-pro",
   "source": "inferencex",
   "vllm_version": "0.29.0",
   "coverage": {
    "scored": 8,
    "total": 8
   },
   "metrics": {
    "measured_or_resolved": {
     "mape": {
      "ttft": null,
      "tpot": null,
      "n": 0
     },
     "shape": {
      "ttft": null,
      "tpot": null,
      "n": 0
     },
     "noise_floor_pct": 1.6
    },
    "all": {
     "mape": {
      "ttft": 51.52078066914498,
      "tpot": 44.771516655214896,
      "n": 8
     },
     "shape": {
      "ttft": 31.943830299038144,
      "tpot": 25.013413581583563,
      "n": 6
     },
     "noise_floor_pct": 1.6
    }
   },
   "rows": [
    {
     "level": "workload",
     "label": "1024:1024",
     "isl": 1024,
     "osl": 1024,
     "coverage": {
      "scored": 8,
      "total": 8
     },
     "metrics": {
      "measured_or_resolved": {
       "mape": {
        "ttft": null,
        "tpot": null,
        "n": 0
       },
       "shape": {
        "ttft": null,
        "tpot": null,
        "n": 0
       },
       "noise_floor_pct": 1.6
      },
      "all": {
       "mape": {
        "ttft": 51.52078066914498,
        "tpot": 44.771516655214896,
        "n": 8
       },
       "shape": {
        "ttft": 31.943830299038144,
        "tpot": 25.013413581583563,
        "n": 6
       },
       "noise_floor_pct": 1.6
      }
     },
     "rows": [
      {
       "level": "gpu",
       "label": "b200",
       "precision": "nvfp4",
       "coverage": {
        "scored": 4,
        "total": 4
       },
       "metrics": {
        "measured_or_resolved": {
         "mape": {
          "ttft": null,
          "tpot": null,
          "n": 0
         },
         "shape": {
          "ttft": null,
          "tpot": null,
          "n": 0
         },
         "noise_floor_pct": 1.6
        },
        "all": {
         "mape": {
          "ttft": 62.891125594049285,
          "tpot": 19.93965930797155,
          "n": 4
         },
         "shape": {
          "ttft": 36.756825124184985,
          "tpot": 22.273048238792096,
          "n": 3
         },
         "noise_floor_pct": 1.6
        }
       },
       "rows": [
        {
         "level": "topology",
         "framework": "vllm",
         "engine_version": "0.29.0",
         "is_multinode": false,
         "parallelism": {
          "dp": 1,
          "ep": 1,
          "pp": 1,
          "tp": 8
         },
         "serving": "aggregated",
         "spec_method": "none",
         "label": "dp1 \u00b7 ep1 \u00b7 pp1 \u00b7 tp8",
         "coverage": {
          "scored": 4,
          "total": 4
         },
         "metrics": {
          "measured_or_resolved": {
           "mape": {
            "ttft": null,
            "tpot": null,
            "n": 0
           },
           "shape": {
            "ttft": null,
            "tpot": null,
            "n": 0
           },
           "noise_floor_pct": 1.6
          },
          "all": {
           "mape": {
            "ttft": 62.891125594049285,
            "tpot": 19.93965930797155,
            "n": 4
           },
           "shape": {
            "ttft": 36.756825124184985,
            "tpot": 22.273048238792096,
            "n": 3
           },
           "noise_floor_pct": 1.6
          }
         },
         "rows": [
          {
           "level": "point",
           "concurrency": 1,
           "tier": "all",
           "measured": {
            "ttft_ms": 160.0,
            "tpot_ms": 7.18
           },
           "predicted": {
            "ttft_ms": 81.9719,
            "tpot_ms": 8.1333
           },
           "error_pct": {
            "ttft": -48.7676,
            "tpot": 13.2771
           },
           "shape": {
            "ttft": null,
            "tpot": null
           }
          },
          {
           "level": "point",
           "concurrency": 4,
           "tier": "all",
           "measured": {
            "ttft_ms": 204.0,
            "tpot_ms": 8.82
           },
           "predicted": {
            "ttft_ms": 91.6538,
            "tpot_ms": 8.9994
           },
           "error_pct": {
            "ttft": -55.0717,
            "tpot": 2.0339
           },
           "shape": {
            "ttft": -12.3049,
            "tpot": -9.9254
           }
          },
          {
           "level": "point",
           "concurrency": 16,
           "tier": "all",
           "measured": {
            "ttft_ms": 368.0,
            "tpot_ms": 13.1
           },
           "predicted": {
            "ttft_ms": 112.0388,
            "tpot_ms": 12.143
           },
           "error_pct": {
            "ttft": -69.5547,
            "tpot": -7.3057
           },
           "shape": {
            "ttft": -40.5741,
            "tpot": -18.1703
           }
          },
          {
           "level": "point",
           "concurrency": 64,
           "tier": "all",
           "measured": {
            "ttft_ms": 821.0,
            "tpot_ms": 13.2
           },
           "predicted": {
            "ttft_ms": 179.2194,
            "tpot_ms": 20.7427
           },
           "error_pct": {
            "ttft": -78.1706,
            "tpot": 57.1419
           },
           "shape": {
            "ttft": -57.3914,
            "tpot": 38.7235
           }
          }
         ]
        }
       ]
      },
      {
       "level": "gpu",
       "label": "h200",
       "precision": "fp8",
       "coverage": {
        "scored": 4,
        "total": 4
       },
       "metrics": {
        "measured_or_resolved": {
         "mape": {
          "ttft": null,
          "tpot": null,
          "n": 0
         },
         "shape": {
          "ttft": null,
          "tpot": null,
          "n": 0
         },
         "noise_floor_pct": 1.6
        },
        "all": {
         "mape": {
          "ttft": 40.15043574424068,
          "tpot": 69.60337400245824,
          "n": 4
         },
         "shape": {
          "ttft": 27.1308354738913,
          "tpot": 27.75377892437503,
          "n": 3
         },
         "noise_floor_pct": 1.6
        }
       },
       "rows": [
        {
         "level": "topology",
         "framework": "vllm",
         "engine_version": "0.29.0",
         "is_multinode": false,
         "parallelism": {
          "dp": 1,
          "ep": 1,
          "pp": 1,
          "tp": 8
         },
         "serving": "aggregated",
         "spec_method": "none",
         "label": "dp1 \u00b7 ep1 \u00b7 pp1 \u00b7 tp8",
         "coverage": {
          "scored": 4,
          "total": 4
         },
         "metrics": {
          "measured_or_resolved": {
           "mape": {
            "ttft": null,
            "tpot": null,
            "n": 0
           },
           "shape": {
            "ttft": null,
            "tpot": null,
            "n": 0
           },
           "noise_floor_pct": 1.6
          },
          "all": {
           "mape": {
            "ttft": 40.15043574424068,
            "tpot": 69.60337400245824,
            "n": 4
           },
           "shape": {
            "ttft": 27.1308354738913,
            "tpot": 27.75377892437503,
            "n": 3
           },
           "noise_floor_pct": 1.6
          }
         },
         "rows": [
          {
           "level": "point",
           "concurrency": 1,
           "tier": "all",
           "measured": {
            "ttft_ms": 168.0,
            "tpot_ms": 7.539
           },
           "predicted": {
            "ttft_ms": 126.2334,
            "tpot_ms": 11.4818
           },
           "error_pct": {
            "ttft": -24.8611,
            "tpot": 52.2981
           },
           "shape": {
            "ttft": null,
            "tpot": null
           }
          },
          {
           "level": "point",
           "concurrency": 4,
           "tier": "all",
           "measured": {
            "ttft_ms": 214.2,
            "tpot_ms": 9.261
           },
           "predicted": {
            "ttft_ms": 150.626,
            "tpot_ms": 13.0108
           },
           "error_pct": {
            "ttft": -29.6798,
            "tpot": 40.4901
           },
           "shape": {
            "ttft": -6.413,
            "tpot": -7.7532
           }
          },
          {
           "level": "point",
           "concurrency": 16,
           "tier": "all",
           "measured": {
            "ttft_ms": 386.4,